{"description":"churn ops","service_type":"agent","components":[{"alias":"prompt","ref":{"kind":"Prompt","name":"churn-summary","version":"1.0.0"}}],"deployment":{"region":{"type":"str","value":"us-east-1"}},"service_config":{"timeout_seconds":{"type":"number","value":30.0}},"content_hash":"sha256:abc","lock_hash":"sha256:def"}
